{
  "CustomerFirstName": "Drew",
  "CustomerLastName": "Davis",
  "EmailAddress": "drew.davis@example.com",
  "PhoneNumber": "(324) 644-9946",
  "NatureOfComplaint": "Website/app issue",
  "IncidentDetails": "I was unable to complete checkout for order #ORD10016 on June 3, 2024; the payment page repeatedly returned an error after I entered my card details.",
  "DesiredResolution": "Confirmation that my card was not charged and a working discount code for the inconvenience."
}